{"adapter":{"instance":"f74434e1-ed69-4613-bdb2-523ed8520098","name":"queue-hook"},"applied_events":[{"content_digest":"sha256:d119d8987464d624a5d1e8e8f11d654bd2545061a60eac0dee9584fccdaad28b","event_id":"queue-77eaf2d90629994e78e20cc8a5fb43fb-01-plan","revision":1,"transition":"plan"},{"content_digest":"sha256:9052a4faff6d97cf0b5be6c9b0ff2fe1be4aebc3b87218db78fefe1610af7b73","event_id":"queue-77eaf2d90629994e78e20cc8a5fb43fb-02-ready","revision":2,"transition":"ready"},{"content_digest":"sha256:deda2fcf5c2bbb5f342d86ca10ba642a81af93eaaef2e3940f3975cea377ec0e","event_id":"queue-77eaf2d90629994e78e20cc8a5fb43fb-03-start","revision":3,"transition":"start"},{"content_digest":"sha256:2580c5e6d959ef4fea98371ff3cd9c07af8f25a4bb8ff967c12524169a30e91c","event_id":"queue-77eaf2d90629994e78e20cc8a5fb43fb-04-advance_stage","revision":4,"transition":"advance_stage"},{"content_digest":"sha256:966037ec01176a3fd826fcf82c045a1170d6b1cd8be7248b4021e09c4fa14f92","event_id":"queue-77eaf2d90629994e78e20cc8a5fb43fb-05-advance_stage","revision":5,"transition":"advance_stage"},{"content_digest":"sha256:4fd3db91f8647a9b6c925786f3cb0f0936488e88394254582d668a04ce295876","event_id":"queue-77eaf2d90629994e78e20cc8a5fb43fb-06-advance_stage","revision":6,"transition":"advance_stage"},{"content_digest":"sha256:ee4f19fb2f8292d2580aeb1c3d70236f9beaeac8c8a57608c3276600c7835f57","event_id":"queue-77eaf2d90629994e78e20cc8a5fb43fb-07-advance_stage","revision":7,"transition":"advance_stage"},{"content_digest":"sha256:b7ce530cdd705a0b253d61cd485bef356bb5cc6c66f2db19595f88ecf2e1c759","event_id":"queue-77eaf2d90629994e78e20cc8a5fb43fb-08-complete","revision":8,"transition":"complete"}],"delivery_policy":{"mode":"standard"},"dependencies":[],"digest":"sha256:625cb1913c3e02eedff7bfde13b7739bab45ac45d5017c550df775b210ab95dd","evidence":{"handoff":{"actor":"queue-hook","level":"locally_verified","method":"instruction_blob_digest","recorded_at":"2026-09-13T23:36:56.536Z","ref":"docs/handoffs/20260914-001400-bound-tracked-file-listing-output.md","source":"docs"},"integration":{"actor":"queue-hook","level":"locally_verified","method":"synchronized_main","recorded_at":"2026-09-13T23:36:56.536Z","source":"git","synchronized_main_commit":"a1ad2c870aa8bf44929037eaa7864180e39912d7"},"merge":{"actor":"queue-hook","base":"main","head_commit":"78981c3b5546b15176efce5b3c9ff3b43da1cf17","level":"locally_verified","merge_commit":"a1ad2c870aa8bf44929037eaa7864180e39912d7","merge_method":"merge","method":"merge_ancestry","recorded_at":"2026-09-13T23:36:56.536Z","source":"git"},"pr":{"actor":"queue","head_commit":"78981c3b5546b15176efce5b3c9ff3b43da1cf17","level":"adapter_attested","method":"delivery_object","pr_number":53,"provider_ref":"https://github.com/inflatable-cookie/northstar/pull/53","recorded_at":"2026-09-13T23:36:56.536Z","source":"queue"},"review":{"actor":"queue","head_commit":"78981c3b5546b15176efce5b3c9ff3b43da1cf17","level":"adapter_attested","method":"delivery_object","recorded_at":"2026-09-13T23:36:56.536Z","review_id":"Independent review of PR #53 at exact head 78981c3. Diff is exactly the three in-scope files (hook, lifecycle-adoption self-test, skill lifecycle README). Verified: finite explicit 4 MiB maxBuffer listing cap above the 1,797,383-byte Bovine listing; >1 MiB listing fixture (1,680,287 bytes) publishes successfully; 4,310,287-byte listing fails closed atomically with bounded ENOBUFS/SIGTERM/status-null evidence; non-zero git exit reports exit status 73 plus stderr; 5,000-file and 4 MiB per-file caps, exact-link refusal, and atomicity preserved. effigy check:lifecycle-adoption OK, effigy qa exit 0, check:posture-advisory OK, git diff --check clean, worktree clean. Non-blocking findings only: unreachable listingBytes>cap refuse branch (ENOBUFS malfunction fires first, consistent with task decisions), bundle-docs section 12 reusable doctrine not updated with the new transport bound (g03.013 precedent; skill README updated), large-listing fixture proves transport not in-listing link refusal, and installed-skill parity drift is exactly this change and expected pre-refresh. Exactly one approval marker posted.","source":"queue","verdict":"approved"},"validation":{"actor":"queue","head_commit":"78981c3b5546b15176efce5b3c9ff3b43da1cf17","level":"adapter_attested","method":"verification_summary","passed":true,"recorded_at":"2026-09-13T23:36:56.536Z","source":"queue"}},"generation":"g03","planning":{"commit":"2b4d56f81a5173f2c9b4916a7056d6341cb6378a","task_blob_digest":"sha256:d9fa5e75e11340de6fcafe81ad5fb3ef093a82cc408ed51920dcd44c180461de"},"portable_digest":"sha256:51fbc428b13fa7047d8d01abdca005a31a9b35060d84d1d87e2fe29a04b637ac","revision":8,"schema_version":"northstar.lifecycle.task-record.v1","stage":"none","status":"complete","task_id":"g03.014","task_path":"docs/roadmaps/g03/014-bound-tracked-file-listing-output.md","updated_at":"2026-09-13T23:36:56.536Z"}
