{"adapter":{"instance":"a93ba147-555d-4c96-b41a-54a8bd4a26b2","name":"queue-hook"},"applied_events":[{"content_digest":"sha256:90635dbe587449233c13d0bc3775f476b9bf6d0bf91efa04c17a877d91be67cd","event_id":"queue-fed18e747e2ecb034eb67928accec325-01-plan","revision":1,"transition":"plan"},{"content_digest":"sha256:1a35725b843086a70b3ea546dab84731bb94b4277716c80023022cc12ffc6466","event_id":"queue-fed18e747e2ecb034eb67928accec325-02-ready","revision":2,"transition":"ready"},{"content_digest":"sha256:a9800020a766e8ab0f2c7cf31658b491fe07312fd1282b428fe7509cfce1560b","event_id":"queue-fed18e747e2ecb034eb67928accec325-03-start","revision":3,"transition":"start"},{"content_digest":"sha256:ab376e11a12531ff1a62ade935bb447906fa05d7601b9c4cb7a5276ef34f6b77","event_id":"queue-fed18e747e2ecb034eb67928accec325-04-advance_stage","revision":4,"transition":"advance_stage"},{"content_digest":"sha256:c54ded677bd3aa93e8c5d184d929b7d13618231ce9824f07d20e68f76c425fe7","event_id":"queue-fed18e747e2ecb034eb67928accec325-05-advance_stage","revision":5,"transition":"advance_stage"},{"content_digest":"sha256:782ee5cf71095eda6b19d599d0e4e1f89884ca1a29f87fbda55161e96ac0c4c4","event_id":"queue-fed18e747e2ecb034eb67928accec325-06-advance_stage","revision":6,"transition":"advance_stage"},{"content_digest":"sha256:e66910ece9007c00f10132a0a5c645cf88244c0bc42183dea14c99009b5c6959","event_id":"queue-fed18e747e2ecb034eb67928accec325-07-advance_stage","revision":7,"transition":"advance_stage"},{"content_digest":"sha256:e6fa8ae2d26d4f5ed76ac5271eb341e785272608c48f6ed45b63319d3b4029d4","event_id":"queue-fed18e747e2ecb034eb67928accec325-08-complete","revision":8,"transition":"complete"}],"delivery_policy":{"mode":"standard"},"dependencies":[],"digest":"sha256:2ea341f845521a3162fc405e6528fb40d08b4e30b555b3de3af819f3c8bfc649","evidence":{"handoff":{"actor":"queue-hook","level":"locally_verified","method":"instruction_blob_digest","recorded_at":"2026-09-13T21:21:13.059Z","ref":"docs/handoffs/20260913-193707-enforce-sole-source-lifecycle-currentness.md","source":"docs"},"integration":{"actor":"queue-hook","level":"locally_verified","method":"synchronized_main","recorded_at":"2026-09-13T21:21:13.059Z","source":"git","synchronized_main_commit":"c83fda38381d088f9e3b1e2a7750cb7a71a06185"},"merge":{"actor":"queue-hook","base":"main","head_commit":"53ddb94d9341835b7be74fd705bbf18cefb3555d","level":"locally_verified","merge_commit":"c83fda38381d088f9e3b1e2a7750cb7a71a06185","merge_method":"merge","method":"merge_ancestry","recorded_at":"2026-09-13T21:21:13.059Z","source":"git"},"pr":{"actor":"queue","head_commit":"53ddb94d9341835b7be74fd705bbf18cefb3555d","level":"adapter_attested","method":"delivery_object","pr_number":51,"provider_ref":"https://github.com/inflatable-cookie/northstar/pull/51","recorded_at":"2026-09-13T21:21:13.059Z","source":"queue"},"review":{"actor":"queue","head_commit":"53ddb94d9341835b7be74fd705bbf18cefb3555d","level":"adapter_attested","method":"delivery_object","recorded_at":"2026-09-13T21:21:13.059Z","review_id":"Ready to merge exact PR head 53ddb94d9341835b7be74fd705bbf18cefb3555d. The revision removes the unsafe Markdown code-context classifier and deliberately fails closed on any exact local link-shaped handoff reference, including fenced, inline, indented, list-continuation, escaped-backtick, and non-1 ordered-marker cases. External URLs, mismatched paths, and sibling handoffs remain non-blocking. Lifecycle core/adoption, installed-skill parity, docs QA, and full QA all pass; PR head matches and the worktree is clean.","source":"queue","verdict":"approved"},"validation":{"actor":"queue","head_commit":"53ddb94d9341835b7be74fd705bbf18cefb3555d","level":"adapter_attested","method":"verification_summary","passed":true,"recorded_at":"2026-09-13T21:21:13.059Z","source":"queue"}},"generation":"g03","planning":{"commit":"67e364792a7a3729e9d95a846ca2cd9fc025bdc6","task_blob_digest":"sha256:1c7d4a2a2b3b44661279f732f812f195bf266a418ce47c1c081c5b04f9e00576"},"portable_digest":"sha256:73226fcffd4cb15f3755884b7969e31c4a482dcc631abc5bddcbf31007be8eeb","revision":8,"schema_version":"northstar.lifecycle.task-record.v1","stage":"none","status":"complete","task_id":"g03.012","task_path":"docs/roadmaps/g03/012-enforce-sole-source-lifecycle-currentness.md","updated_at":"2026-09-13T21:21:13.059Z"}
