{"adapter":{"instance":"0bdadfb4-d8d2-43b4-b118-11c1ab253fd9","name":"queue-hook"},"applied_events":[{"content_digest":"sha256:c0f3796ee2c450067343a47182683ccc90de2c4d2b00b06efab9365306c7aa38","event_id":"queue-e2408467450ab584ce85a776d2ed6f9f-01-plan","revision":1,"transition":"plan"},{"content_digest":"sha256:4bcd8560099835bd41bc8f9d46ab3534c923688325db324616476a95161e5116","event_id":"queue-e2408467450ab584ce85a776d2ed6f9f-02-ready","revision":2,"transition":"ready"},{"content_digest":"sha256:6e7a42a4f1677ebb2001ff4acc1d119240e24db2dadce4103d03c3bff12d7cbe","event_id":"queue-e2408467450ab584ce85a776d2ed6f9f-03-start","revision":3,"transition":"start"},{"content_digest":"sha256:be04d3b3e2ba0f71030d33d03dccede2cd6c1c968bb6d86fc77e6abfe3143e0d","event_id":"queue-e2408467450ab584ce85a776d2ed6f9f-04-advance_stage","revision":4,"transition":"advance_stage"},{"content_digest":"sha256:30566e566860828d64141616c93be02bda1f0cde3f82cd0ced1bf0a716e61e70","event_id":"queue-e2408467450ab584ce85a776d2ed6f9f-05-advance_stage","revision":5,"transition":"advance_stage"},{"content_digest":"sha256:1e91069d40da425338ec9bfbe97baecb5dae1fbddc93903ac104278a361ed451","event_id":"queue-e2408467450ab584ce85a776d2ed6f9f-06-advance_stage","revision":6,"transition":"advance_stage"},{"content_digest":"sha256:5bd057a15336e4904e9c11c9abf80be719f0371ab540556c03510799db2452b2","event_id":"queue-e2408467450ab584ce85a776d2ed6f9f-07-advance_stage","revision":7,"transition":"advance_stage"},{"content_digest":"sha256:3edc0111ede1e7c42625cf7da441ef7f762d4a4f52e6107bf2e99572cf00479e","event_id":"queue-e2408467450ab584ce85a776d2ed6f9f-08-complete","revision":8,"transition":"complete"}],"delivery_policy":{"mode":"standard"},"dependencies":[],"digest":"sha256:888d75786d747f9965efa51b4b492c005aaf967a8f6504715e3b6be0f2760099","evidence":{"handoff":{"actor":"queue-hook","level":"locally_verified","method":"instruction_blob_digest","recorded_at":"2026-09-13T01:11:22.511Z","ref":"docs/handoffs/20260913-014026-pin-queue-hook-runtime.md","source":"docs"},"integration":{"actor":"queue-hook","level":"locally_verified","method":"synchronized_main","recorded_at":"2026-09-13T01:11:22.511Z","source":"git","synchronized_main_commit":"21ff2fac4132aacfbb1d223ad46c379634d5ae58"},"merge":{"actor":"queue-hook","base":"main","head_commit":"03bca9a5e0d1f24d5df706330f8e1f84088fe139","level":"locally_verified","merge_commit":"21ff2fac4132aacfbb1d223ad46c379634d5ae58","merge_method":"merge","method":"merge_ancestry","recorded_at":"2026-09-13T01:11:22.511Z","source":"git"},"pr":{"actor":"queue","head_commit":"03bca9a5e0d1f24d5df706330f8e1f84088fe139","level":"adapter_attested","method":"delivery_object","pr_number":47,"provider_ref":"https://github.com/inflatable-cookie/northstar/pull/47","recorded_at":"2026-09-13T01:11:22.511Z","source":"queue"},"review":{"actor":"queue","head_commit":"03bca9a5e0d1f24d5df706330f8e1f84088fe139","level":"adapter_attested","method":"delivery_object","recorded_at":"2026-09-13T01:11:22.511Z","review_id":"Verified g03.008 at exact head 03bca9a5e0d1f24d5df706330f8e1f84088fe139 against main base 7c2b371f7a120d45864b90d05af2a947cd295374. Canonical authorization is the committed handoff docs/handoffs/20260913-014026-pin-queue-hook-runtime.md on planning commit 7c2b371; its queue approval authorizes this corrective continuation, and its blob matches the submitted handoff. Roadmap g03.008 is the sole active lane, UI none, and skipPRReview is false. PR #47 is open, non-draft, MERGEABLE/CLEAN, based on the expected main head; remote branch head and local HEAD both equal the expected SHA, the head descends from base, and no workflow files or Queue source are changed. The posted review comment 5649823893 is the sole review record because formal reviews are empty; it has exactly one marker: northstar-review:0bdadfb4-d8d2-43b4-b118-11c1ab253fd9:db241ca1-8c3b-44bb-8e3a-743a84945d34:03bca9a5e0d1f24d5df706330f8e1f84088fe139:ready_to_merge. Reviewer state is finished/idle in the retained worker workspace, using codex/gpt-5.6-sol; authoring worker state used pi/deepseek/deepseek-flash, so underlying provider/model identities are independent. The review reports no blocking findings and records the required focused lifecycle, QA/docs, QA, posture, diff-check, and byte-parity evidence as passed; no broad validation was rerun here per the evidence-only boundary. Read-only repository checks confirm clean index/worktree, unchanged g03.007 lifecycle record, absent stranded g03.007 handoff, executable launcher, seven committed schemas plus two runtime scripts, and byte-identical launcher/core/adapter copies across canonical, dogfood, and starter surfaces. Current Queue task phase is verifying with no unresolved dependencies.","source":"queue","verdict":"approved"},"validation":{"actor":"queue","head_commit":"03bca9a5e0d1f24d5df706330f8e1f84088fe139","level":"adapter_attested","method":"verification_summary","passed":true,"recorded_at":"2026-09-13T01:11:22.511Z","source":"queue"}},"generation":"g03","planning":{"commit":"7c2b371f7a120d45864b90d05af2a947cd295374","task_blob_digest":"sha256:ba00904b21f630d56d27075442c99dce20f91caf0e70f7c3926262ea743c4853"},"portable_digest":"sha256:7a3f5fe8d5048d4f743f24d0d215236f6d8d4a554fe24af59012a638185a98fc","revision":8,"schema_version":"northstar.lifecycle.task-record.v1","stage":"none","status":"complete","task_id":"g03.008","task_path":"docs/roadmaps/g03/008-pin-queue-hook-runtime.md","updated_at":"2026-09-13T01:11:22.511Z"}
