{"adapter":{"instance":"b45c4f85-aa3c-46b4-920d-0bd26773faca","name":"queue-hook"},"applied_events":[{"content_digest":"sha256:258ba63b314a1d4516982ba217e38cb88b20c1cd826c5c425ebafc0aeb60ef78","event_id":"queue-0309c5f0001da85397551fc613deef5d-01-plan","revision":1,"transition":"plan"},{"content_digest":"sha256:13f04eaaecc654b1ad1e30178ea5f9979e56637ea3486d4d22fb0cf136c0ca24","event_id":"queue-0309c5f0001da85397551fc613deef5d-02-ready","revision":2,"transition":"ready"},{"content_digest":"sha256:224d0e579326afb0141371ddfe689a22126760fc774d5c9b490aff806f66cdea","event_id":"queue-0309c5f0001da85397551fc613deef5d-03-start","revision":3,"transition":"start"},{"content_digest":"sha256:b3959018d14a5e3755e9e6c38552e39bc365f6da6527bed9780ac2682df8ba3e","event_id":"queue-0309c5f0001da85397551fc613deef5d-04-advance_stage","revision":4,"transition":"advance_stage"},{"content_digest":"sha256:d306d4cf0153b043cda9a5650b85b59a61012a32e872af531a1f757b0be53956","event_id":"queue-0309c5f0001da85397551fc613deef5d-05-advance_stage","revision":5,"transition":"advance_stage"},{"content_digest":"sha256:34151c72ba761716b27cb25728e44753789ff847501574dcd7dc8a9da1539ba7","event_id":"queue-0309c5f0001da85397551fc613deef5d-06-advance_stage","revision":6,"transition":"advance_stage"},{"content_digest":"sha256:3efdd16d956dde1fb44f2852546d6e1fbb33f393c211db32b19198e701c95eb2","event_id":"queue-0309c5f0001da85397551fc613deef5d-07-advance_stage","revision":7,"transition":"advance_stage"},{"content_digest":"sha256:39fa84c6fa8299047b3568f012d74c2d429bed3ea2b305457954ec5aa89c7501","event_id":"queue-0309c5f0001da85397551fc613deef5d-08-complete","revision":8,"transition":"complete"}],"delivery_policy":{"mode":"standard"},"dependencies":[],"digest":"sha256:025066786b2d9af4821307a2b06b15b6cab8bf47a4a816db22bed66b9faa8c9b","evidence":{"handoff":{"actor":"queue-hook","level":"locally_verified","method":"instruction_blob_digest","recorded_at":"2026-09-12T21:15:19.779Z","ref":"docs/handoffs/20260912-205302-adopt-portable-lifecycle.md","source":"docs"},"integration":{"actor":"queue-hook","level":"locally_verified","method":"synchronized_main","recorded_at":"2026-09-12T21:15:19.779Z","source":"git","synchronized_main_commit":"9c1a3fe275d505696871feb680e3ec69fbf8f522"},"merge":{"actor":"queue-hook","base":"main","head_commit":"60d302d0f8f67f7c1b413c7fa6fdc04f66158aaa","level":"locally_verified","merge_commit":"64f953e58547f7d9a8236a1cfe588ea5099fc66b","merge_method":"merge","method":"merge_ancestry","recorded_at":"2026-09-12T21:15:19.779Z","source":"git"},"pr":{"actor":"queue","head_commit":"60d302d0f8f67f7c1b413c7fa6fdc04f66158aaa","level":"adapter_attested","method":"delivery_object","pr_number":45,"provider_ref":"https://github.com/inflatable-cookie/northstar/pull/45","recorded_at":"2026-09-12T21:15:19.779Z","source":"queue"},"review":{"actor":"queue","head_commit":"60d302d0f8f67f7c1b413c7fa6fdc04f66158aaa","level":"adapter_attested","method":"delivery_object","recorded_at":"2026-09-12T21:15:19.779Z","review_id":"g03.006 verified: HEAD 60d302d matches expected and PR45 head; base 779d0ee == origin/main == HEAD parent, MERGEABLE/CLEAN; review comment 5648708967 names exact head with ready_to_merge and trailer binding task b45c4f85 to head; reviewer attests independence (no worker transcript read, distinct reviewer run be1085f8); all 10 oracle rows covered, F1-F2 scoped post-merge integration prerequisites (held-safe), F3-F6 minor/known, no cutover claimed","source":"queue","verdict":"approved"},"validation":{"actor":"queue","head_commit":"60d302d0f8f67f7c1b413c7fa6fdc04f66158aaa","level":"adapter_attested","method":"verification_summary","passed":true,"recorded_at":"2026-09-12T21:15:19.779Z","source":"queue"}},"generation":"g03","planning":{"commit":"5687e91a7e1f2206a5d8457c6ba7222829b84575","task_blob_digest":"sha256:9d4633ff5858a085946190690a9bcb3a401a3866ff73446f4e4f54ef067cdaf3"},"portable_digest":"sha256:617efef464af46d0c2e44c4f3a3a44285c8b1bdb789ed57ebeec93aca4913c63","revision":8,"schema_version":"northstar.lifecycle.task-record.v1","stage":"none","status":"complete","task_id":"g03.006","task_path":"docs/roadmaps/g03/006-adopt-portable-lifecycle.md","updated_at":"2026-09-12T21:15:19.779Z"}
