{"adapter":{"instance":"75ad3bd6-5d74-44e0-a3e8-35b2a30d2fe6","name":"queue-hook"},"applied_events":[{"content_digest":"sha256:57859a00af66e01582f13091e068b8480bf663d06ea004b021f19fd84d085bb3","event_id":"queue-a3a90beadf3b5877f81fdfd2ff5e3750-01-plan","revision":1,"transition":"plan"},{"content_digest":"sha256:6c108894014234e27383e23bcdcd426a16f387e18b0949d793c4dbdfb1a22566","event_id":"queue-a3a90beadf3b5877f81fdfd2ff5e3750-02-ready","revision":2,"transition":"ready"},{"content_digest":"sha256:9119f65de0c4a564190a47eeffe70cb1e32305e7bdebd43bf47c5e99050a0998","event_id":"queue-a3a90beadf3b5877f81fdfd2ff5e3750-03-start","revision":3,"transition":"start"},{"content_digest":"sha256:1267a1697c2350eb643f7c52f5d9599152d0b656428a93ff4a901a5bf7277435","event_id":"queue-a3a90beadf3b5877f81fdfd2ff5e3750-04-advance_stage","revision":4,"transition":"advance_stage"},{"content_digest":"sha256:2d3d14bcaef55e5d87fa058f13c32076ebbc94b1229f79afb60976d80296ae8d","event_id":"queue-a3a90beadf3b5877f81fdfd2ff5e3750-05-advance_stage","revision":5,"transition":"advance_stage"},{"content_digest":"sha256:7316fe41f8bf69fe3a22bfe6e231c05f92487e8c1ea7dc8d83c66f6372adbe5f","event_id":"queue-a3a90beadf3b5877f81fdfd2ff5e3750-06-advance_stage","revision":6,"transition":"advance_stage"},{"content_digest":"sha256:0da01d56b1da413f2f553321b74e10194a06f150586f0079adb106c7396280a0","event_id":"queue-a3a90beadf3b5877f81fdfd2ff5e3750-07-advance_stage","revision":7,"transition":"advance_stage"},{"content_digest":"sha256:7096f4ee9bcda8fcc502515af1f31b58d33b3a6f28c5f65cd8250e51702b5a28","event_id":"queue-a3a90beadf3b5877f81fdfd2ff5e3750-08-complete","revision":8,"transition":"complete"}],"delivery_policy":{"mode":"standard"},"dependencies":[],"digest":"sha256:ba3422694b358b8e89e0a3ae00f65c9efd7cc84b64d272af8cab477d939feffa","evidence":{"handoff":{"actor":"queue-hook","level":"locally_verified","method":"instruction_blob_digest","recorded_at":"2026-09-21T00:07:06.802Z","ref":"docs/handoffs/20260920-153800-g03-021-converge-terminal-closeout-authority.md","source":"docs"},"integration":{"actor":"queue-hook","level":"locally_verified","method":"synchronized_main","recorded_at":"2026-09-21T00:07:06.802Z","source":"git","synchronized_main_commit":"9f1e4f1f31bc3fb1020690a06c3342b58cf63531"},"merge":{"actor":"queue-hook","base":"main","head_commit":"a822e18ebe78ac7974608d00d1ab8ad535216ba7","level":"locally_verified","merge_commit":"e95338a7ed9cc17d097bf77a9446ac14a4ab8b70","merge_method":"merge","method":"merge_ancestry","recorded_at":"2026-09-21T00:07:06.802Z","source":"git"},"pr":{"actor":"queue","head_commit":"a822e18ebe78ac7974608d00d1ab8ad535216ba7","level":"adapter_attested","method":"delivery_object","pr_number":60,"provider_ref":"https://github.com/inflatable-cookie/northstar/pull/60","recorded_at":"2026-09-21T00:07:06.802Z","source":"queue"},"review":{"actor":"queue","head_commit":"a822e18ebe78ac7974608d00d1ab8ad535216ba7","level":"adapter_attested","method":"delivery_object","recorded_at":"2026-09-21T00:07:06.802Z","review_id":"Independent review of PR #60 at a822e18ebe78ac7974608d00d1ab8ad535216ba7 found no remaining blocking issues. Terminal closeout convergence and duplicate generated-block refusal match the canonical task; effigy qa, effigy qa:docs, and git diff --check pass; checkout and PR head match and are clean.","source":"queue","verdict":"approved"},"validation":{"actor":"queue","head_commit":"a822e18ebe78ac7974608d00d1ab8ad535216ba7","level":"adapter_attested","method":"verification_summary","passed":true,"recorded_at":"2026-09-21T00:07:06.802Z","source":"queue"}},"generation":"g03","planning":{"commit":"1f1f417fd83ecd027917b30b11b5dfe911e4d947","task_blob_digest":"sha256:1bfad2a08776dc55ea8ab771b0cf8e0dc814dbea0bf066d071be364686ef1aaf"},"portable_digest":"sha256:5101c0839adb1505b70a5db7fb2c6e3337aff2fbc9420a05083043800bd5f46e","revision":8,"schema_version":"northstar.lifecycle.task-record.v1","stage":"none","status":"complete","task_id":"g03.021","task_path":"docs/roadmaps/g03/021-converge-terminal-closeout-authority.md","updated_at":"2026-09-21T00:07:06.802Z"}
