{"adapter":{"instance":"96e18bdf-7205-4666-9981-d6838ba89f3b","name":"queue-hook"},"applied_events":[{"content_digest":"sha256:82e80d7e0f6b5f7a66c924c9e9aa34be155af2d369fa448ca433eff03388a6d4","event_id":"queue-5655c97b39191c9690292368f47d37d8-01-plan","revision":1,"transition":"plan"},{"content_digest":"sha256:c91fb6fab107d9620f47c5748964e973011d47bb5fb7a960de26714fc8026511","event_id":"queue-5655c97b39191c9690292368f47d37d8-02-ready","revision":2,"transition":"ready"},{"content_digest":"sha256:37a298e8ef081cde7ada5cc69d1afb42bc3bc8e7108f2336aa05b86bb79c897e","event_id":"queue-5655c97b39191c9690292368f47d37d8-03-start","revision":3,"transition":"start"},{"content_digest":"sha256:4bfc0d528c788a3a51266bef855b9cc673c53649cf026ab9f528bcca18e94742","event_id":"queue-5655c97b39191c9690292368f47d37d8-04-advance_stage","revision":4,"transition":"advance_stage"},{"content_digest":"sha256:06749a1ab0ae8698077f895936e4ba601c5da169935a4b23e285092661c2a355","event_id":"queue-5655c97b39191c9690292368f47d37d8-05-advance_stage","revision":5,"transition":"advance_stage"},{"content_digest":"sha256:e910beb07c500c8415af6663fc987bcff56f548d6f74e859b6e9d5d545ee16fa","event_id":"queue-5655c97b39191c9690292368f47d37d8-06-advance_stage","revision":6,"transition":"advance_stage"},{"content_digest":"sha256:c68c454a050ae172aa46e7b2d25c6ae65664c43e4a95c27569e8732238a49e9f","event_id":"queue-5655c97b39191c9690292368f47d37d8-07-advance_stage","revision":7,"transition":"advance_stage"},{"content_digest":"sha256:581ea2df7da5af6ecf4ecc3540ae3e473a5995cfdd7c44015eae95e5a4e2cc87","event_id":"queue-5655c97b39191c9690292368f47d37d8-08-complete","revision":8,"transition":"complete"}],"delivery_policy":{"mode":"standard"},"dependencies":[],"digest":"sha256:a5b8006f700e791ff4bb68f504746a9f2431bb1711abd70292673e536a80b9ad","evidence":{"handoff":{"actor":"queue-hook","level":"locally_verified","method":"instruction_blob_digest","recorded_at":"2026-09-13T00:14:39.330Z","ref":"docs/handoffs/20260912-235520-finish-hook-owned-closeout.md","source":"docs"},"integration":{"actor":"queue-hook","level":"locally_verified","method":"synchronized_main","recorded_at":"2026-09-13T00:14:39.330Z","source":"git","synchronized_main_commit":"0c0b1aec1b3a8ed36082f89ebc19850f6461e449"},"merge":{"actor":"queue-hook","base":"main","head_commit":"db65341a21f0b4155d8bcc5a17f65ec5248a5167","level":"locally_verified","merge_commit":"0c0b1aec1b3a8ed36082f89ebc19850f6461e449","merge_method":"merge","method":"merge_ancestry","recorded_at":"2026-09-13T00:14:39.330Z","source":"git"},"pr":{"actor":"queue","head_commit":"db65341a21f0b4155d8bcc5a17f65ec5248a5167","level":"adapter_attested","method":"delivery_object","pr_number":46,"provider_ref":"https://github.com/inflatable-cookie/northstar/pull/46","recorded_at":"2026-09-13T00:14:39.330Z","source":"queue"},"review":{"actor":"queue","head_commit":"db65341a21f0b4155d8bcc5a17f65ec5248a5167","level":"adapter_attested","method":"delivery_object","recorded_at":"2026-09-13T00:14:39.330Z","review_id":"Evidence-only verification at head db65341a21f0b4155d8bcc5a17f65ec5248a5167. Authorization: committed handoff carries queue approval and matches task g03.007. Review identity: comment 5649587163 holds exactly one marker with matching task/run/head and ready_to_merge. Independence: worker zai/glm-5.3-flash vs reviewer deepseek/deepseek-flash, distinct models, no worker transcript read. Base: PR #46 open non-draft against main at the expected head, MERGEABLE/CLEAN, origin/main unchanged at d805e2c, head descendant of base, worktree clean. Findings: all four round-1 blockers explicitly resolved in the comment; only non-blocking notes remain. No tests run, no files touched.","source":"queue","verdict":"approved"},"validation":{"actor":"queue","head_commit":"db65341a21f0b4155d8bcc5a17f65ec5248a5167","level":"adapter_attested","method":"verification_summary","passed":true,"recorded_at":"2026-09-13T00:14:39.330Z","source":"queue"}},"generation":"g03","planning":{"commit":"d805e2c9b543b9f675071d1abc0d8b99166e3433","task_blob_digest":"sha256:51b21e692bc81b562b55e2aff4d3b6c76978b634572ae5d2d867e0b8d9b17fb1"},"portable_digest":"sha256:11bd35308502975cdda9608e85697e18aed7e380e3e1870f303e0aa8003fa395","revision":8,"schema_version":"northstar.lifecycle.task-record.v1","stage":"none","status":"complete","task_id":"g03.007","task_path":"docs/roadmaps/g03/007-finish-hook-owned-closeout.md","updated_at":"2026-09-13T00:14:39.330Z"}
