{"adapter":{"instance":"9d4dd7a0-c090-4cce-9269-4f36f9c3b08d","name":"queue-hook"},"applied_events":[{"content_digest":"sha256:a6e982a9c2a6699083115778f3d3f0e1e82cc85545dc9cafdf1642217d06c7a2","event_id":"queue-8cb6a986a0cc87a72cdb78583b16e696-01-plan","revision":1,"transition":"plan"},{"content_digest":"sha256:acadada05b3b60bfedc2feeec9e83d2ad1636a8a3db226b1329bbbcd3c230db5","event_id":"queue-8cb6a986a0cc87a72cdb78583b16e696-02-ready","revision":2,"transition":"ready"},{"content_digest":"sha256:d8af9883fab819ae7682925d6d80ac0062d685ffd9cdf4d53a45b1fe83c6319f","event_id":"queue-8cb6a986a0cc87a72cdb78583b16e696-03-start","revision":3,"transition":"start"},{"content_digest":"sha256:f7c0d014fee68186c49eb7877110624dfb952ded5474db49d95e3bb90812eb67","event_id":"queue-8cb6a986a0cc87a72cdb78583b16e696-04-advance_stage","revision":4,"transition":"advance_stage"},{"content_digest":"sha256:fb88f5b845ad88c830ab264302bee975d76d8de514c03e4dd5ae01042022456d","event_id":"queue-8cb6a986a0cc87a72cdb78583b16e696-05-advance_stage","revision":5,"transition":"advance_stage"},{"content_digest":"sha256:fbda76647a72820a7c03169657f65b47629a9d354ba645e5da0469947b7d572a","event_id":"queue-8cb6a986a0cc87a72cdb78583b16e696-06-advance_stage","revision":6,"transition":"advance_stage"},{"content_digest":"sha256:69f3615a2cdd4c8473f49aebe91dc895198f8d12b5e0857fbc29117cee5b66b9","event_id":"queue-8cb6a986a0cc87a72cdb78583b16e696-07-advance_stage","revision":7,"transition":"advance_stage"},{"content_digest":"sha256:399ef3cb079de49f519fff6a8814233854244b7ac0293195fad30066d343108d","event_id":"queue-8cb6a986a0cc87a72cdb78583b16e696-08-complete","revision":8,"transition":"complete"}],"delivery_policy":{"mode":"standard"},"dependencies":[],"digest":"sha256:b04543c372ffeb75b3fd0813e7f541f216d22f3c6bd3cb03dcd5e175ea225374","evidence":{"handoff":{"actor":"queue-hook","level":"locally_verified","method":"instruction_blob_digest","recorded_at":"2026-09-13T23:06:16.519Z","ref":"docs/handoffs/20260913-233929-support-large-markdown-backlink-scan.md","source":"docs"},"integration":{"actor":"queue-hook","level":"locally_verified","method":"synchronized_main","recorded_at":"2026-09-13T23:06:16.519Z","source":"git","synchronized_main_commit":"83adb696b7e67dc152bc5ddd0885ca61d575d0fa"},"merge":{"actor":"queue-hook","base":"main","head_commit":"601ce5d9c60170b3527f93fc64727fa60e396bce","level":"locally_verified","merge_commit":"83adb696b7e67dc152bc5ddd0885ca61d575d0fa","merge_method":"merge","method":"merge_ancestry","recorded_at":"2026-09-13T23:06:16.519Z","source":"git"},"pr":{"actor":"queue","head_commit":"601ce5d9c60170b3527f93fc64727fa60e396bce","level":"adapter_attested","method":"delivery_object","pr_number":52,"provider_ref":"https://github.com/inflatable-cookie/northstar/pull/52","recorded_at":"2026-09-13T23:06:16.519Z","source":"queue"},"review":{"actor":"queue","head_commit":"601ce5d9c60170b3527f93fc64727fa60e396bce","level":"adapter_attested","method":"delivery_object","recorded_at":"2026-09-13T23:06:16.519Z","review_id":"PR #52 approved at head 601ce5d9c60170b3527f93fc64727fa60e396bce. One-line bound raise 256KiB to 4MiB plus clean/linked/oversized fixtures and doctrine sync, all in owned paths. Reviewer ran adoption, core, docs QA, full QA (all pass), diff check clean, head clean.","source":"queue","verdict":"approved"},"validation":{"actor":"queue","head_commit":"601ce5d9c60170b3527f93fc64727fa60e396bce","level":"adapter_attested","method":"verification_summary","passed":true,"recorded_at":"2026-09-13T23:06:16.519Z","source":"queue"}},"generation":"g03","planning":{"commit":"aac1ab9df42169d241c4dd8e252854afa63bca71","task_blob_digest":"sha256:e8f62ca421bfb2a115185a210a987d25e2ec0845ddeed84953d4e3ede57c0ae6"},"portable_digest":"sha256:fb95455349540f1ad41b732e4b73f6e680e5cece68f65d537118d8fd041f102e","revision":8,"schema_version":"northstar.lifecycle.task-record.v1","stage":"none","status":"complete","task_id":"g03.013","task_path":"docs/roadmaps/g03/013-support-large-markdown-backlink-scan.md","updated_at":"2026-09-13T23:06:16.519Z"}
