{"adapter":{"instance":"1e03e1e7-d6eb-4e89-a8bb-ab32a25b118a","name":"queue-hook"},"applied_events":[{"content_digest":"sha256:6349193819b10c74472da1833e23fe827ceb2a6202a0b6020d893a49e8d819b9","event_id":"queue-0b043be4cd3e3ea4b99a8b0d0193d845-01-plan","revision":1,"transition":"plan"},{"content_digest":"sha256:ca77b7f6c1d6a2486d52b2c86f43362c6f4a41f5f15595d95ef363deece1d783","event_id":"queue-0b043be4cd3e3ea4b99a8b0d0193d845-02-ready","revision":2,"transition":"ready"},{"content_digest":"sha256:002c5e1fc4708468703ee1fea43596cdfada22a4544879e24be51200ba3f383d","event_id":"queue-0b043be4cd3e3ea4b99a8b0d0193d845-03-start","revision":3,"transition":"start"},{"content_digest":"sha256:bf8a637118c1ce4f4cf76f51b1612a2e958047274176065ce3b2ba30b331b74d","event_id":"queue-0b043be4cd3e3ea4b99a8b0d0193d845-04-advance_stage","revision":4,"transition":"advance_stage"},{"content_digest":"sha256:4cf2a9164db6958588cb793a44d273b45013142e6984bea271a8b92b8917d5d2","event_id":"queue-0b043be4cd3e3ea4b99a8b0d0193d845-05-advance_stage","revision":5,"transition":"advance_stage"},{"content_digest":"sha256:a9a73a2673c93cac7eeed7b1ed70399208356ec5eef4e4468dfe47dcc7654e5f","event_id":"queue-0b043be4cd3e3ea4b99a8b0d0193d845-06-advance_stage","revision":6,"transition":"advance_stage"},{"content_digest":"sha256:bac1933d167ca2400b00e10664aa1d1f7b9f61d80843826c4b1dc4c8e22eb8f4","event_id":"queue-0b043be4cd3e3ea4b99a8b0d0193d845-07-advance_stage","revision":7,"transition":"advance_stage"},{"content_digest":"sha256:88dc9969a2e418283fdecec67041e7638983c308aede15276ebebd200694a361","event_id":"queue-0b043be4cd3e3ea4b99a8b0d0193d845-08-complete","revision":8,"transition":"complete"}],"delivery_policy":{"mode":"standard"},"dependencies":[],"digest":"sha256:f2d73b780dd1f0701b02c078dd8a255629f16a647d90d1d7ddea9138c07f58c3","evidence":{"handoff":{"actor":"queue-hook","level":"locally_verified","method":"instruction_blob_digest","recorded_at":"2026-09-15T17:41:06.168Z","ref":"docs/handoffs/20260915-171254-consume-closed-generation-lifecycle-fragments.md","source":"docs"},"integration":{"actor":"queue-hook","level":"locally_verified","method":"synchronized_main","recorded_at":"2026-09-15T17:41:06.168Z","source":"git","synchronized_main_commit":"d870068c397e9525be0c75b94348ba3383008f48"},"merge":{"actor":"queue-hook","base":"main","head_commit":"4444c02e4379019c3be5dbd627026e3f014e5ce4","level":"locally_verified","merge_commit":"d870068c397e9525be0c75b94348ba3383008f48","merge_method":"merge","method":"merge_ancestry","recorded_at":"2026-09-15T17:41:06.168Z","source":"git"},"pr":{"actor":"queue","head_commit":"4444c02e4379019c3be5dbd627026e3f014e5ce4","level":"adapter_attested","method":"delivery_object","pr_number":57,"provider_ref":"https://github.com/inflatable-cookie/northstar/pull/57","recorded_at":"2026-09-15T17:41:06.168Z","source":"queue"},"review":{"actor":"queue","head_commit":"4444c02e4379019c3be5dbd627026e3f014e5ce4","level":"adapter_attested","method":"delivery_object","recorded_at":"2026-09-15T17:41:06.168Z","review_id":"g03.018 review: PR #57 at 4444c02e implements receipt-publication-consumes-fragments plus lexical catch-up exactly per the task's authority, replay, and refusal rules, with oracle and adoption fixtures covering every acceptance clause. effigy check:lifecycle-core (97), check:lifecycle-adoption, and full effigy qa (exit 0) all pass; diff --check clean; tree clean at the expected head. Verdict: ready_to_merge.","source":"queue","verdict":"approved"},"validation":{"actor":"queue","head_commit":"4444c02e4379019c3be5dbd627026e3f014e5ce4","level":"adapter_attested","method":"verification_summary","passed":true,"recorded_at":"2026-09-15T17:41:06.168Z","source":"queue"}},"generation":"g03","planning":{"commit":"db8dac588c36b3db5854ee0723f00017569b923a","task_blob_digest":"sha256:f3ff133cf9417409e31236d081f018e7be2756e5b471e38775bf17156d1dd81d"},"portable_digest":"sha256:1073cd7c73945134b09dca084d05ac23747fd119cd6f4d05116af2b66b329013","revision":8,"schema_version":"northstar.lifecycle.task-record.v1","stage":"none","status":"complete","task_id":"g03.018","task_path":"docs/roadmaps/g03/018-consume-closed-generation-lifecycle-fragments.md","updated_at":"2026-09-15T17:41:06.168Z"}
