{"adapter":{"instance":"413b9dc4-55e3-42c7-b164-8362dc8b8971","name":"queue-hook"},"applied_events":[{"content_digest":"sha256:09828c0a372fcdcc914323d16e1908c9acbcc8788739a35df30d74f26c0b7368","event_id":"queue-18829adebebd20e05019491eb3e6b446-01-plan","revision":1,"transition":"plan"},{"content_digest":"sha256:ed22c8146e1628bbba2f86ffde2a6abd81407488966fa95bfc8d193dd4c6d252","event_id":"queue-18829adebebd20e05019491eb3e6b446-02-ready","revision":2,"transition":"ready"},{"content_digest":"sha256:d988ff72c8831c00c6381b573ad1afe7220364dd94a8ea86773eada90ed2b97a","event_id":"queue-18829adebebd20e05019491eb3e6b446-03-start","revision":3,"transition":"start"},{"content_digest":"sha256:b655fade02b78ad50b1cd127be1f84be633054820bd1a8ae89ee14079ed73428","event_id":"queue-18829adebebd20e05019491eb3e6b446-04-advance_stage","revision":4,"transition":"advance_stage"},{"content_digest":"sha256:978f56da3f9f73e129d8fcbf457eaedf1e940666a58b0c6b85a7d1aef7d998bb","event_id":"queue-18829adebebd20e05019491eb3e6b446-05-advance_stage","revision":5,"transition":"advance_stage"},{"content_digest":"sha256:0745ee913b508e7995ef1053c3bcb01d037f34767d55308abaab989e610ea716","event_id":"queue-18829adebebd20e05019491eb3e6b446-06-advance_stage","revision":6,"transition":"advance_stage"},{"content_digest":"sha256:da6c11ca3b1a6d130089a3813cf7aa224c9846a7bcf5b3ada027d7cd11fc1943","event_id":"queue-18829adebebd20e05019491eb3e6b446-07-advance_stage","revision":7,"transition":"advance_stage"},{"content_digest":"sha256:3e1a1b45b04e83d152d38f6693aab13d6066846fa4df4d67c00a073def7859bf","event_id":"queue-18829adebebd20e05019491eb3e6b446-08-complete","revision":8,"transition":"complete"}],"delivery_policy":{"mode":"standard"},"dependencies":[],"digest":"sha256:4fc88cc4206d2d2427a825759ee29a12540285a0816248e2d3feda85207cf988","evidence":{"handoff":{"actor":"queue-hook","level":"locally_verified","method":"instruction_blob_digest","recorded_at":"2026-09-15T08:16:20.162Z","ref":"docs/handoffs/20260915-082448-reject-transient-handoff-backlinks-before-merge.md","source":"docs"},"integration":{"actor":"queue-hook","level":"locally_verified","method":"synchronized_main","recorded_at":"2026-09-15T08:16:20.162Z","source":"git","synchronized_main_commit":"664320553b7105a14f1bf07638752effc0409936"},"merge":{"actor":"queue-hook","base":"main","head_commit":"3c56cf77d35e746f06702eef4d8ee1f98ccd29fb","level":"locally_verified","merge_commit":"664320553b7105a14f1bf07638752effc0409936","merge_method":"merge","method":"merge_ancestry","recorded_at":"2026-09-15T08:16:20.162Z","source":"git"},"pr":{"actor":"queue","head_commit":"3c56cf77d35e746f06702eef4d8ee1f98ccd29fb","level":"adapter_attested","method":"delivery_object","pr_number":56,"provider_ref":"https://github.com/inflatable-cookie/northstar/pull/56","recorded_at":"2026-09-15T08:16:20.162Z","source":"queue"},"review":{"actor":"queue","head_commit":"3c56cf77d35e746f06702eef4d8ee1f98ccd29fb","level":"adapter_attested","method":"delivery_object","recorded_at":"2026-09-15T08:16:20.162Z","review_id":"g03.017 review: ready_to_merge at 3c56cf7. Shared backlink resolver, read-only reviewed-head pre-merge gate, v1/v2 compatibility, unchanged closeout refusal all verified; lifecycle-adoption, lifecycle-core, qa, qa:docs, and diff-check pass with a clean tree.","source":"queue","verdict":"approved"},"validation":{"actor":"queue","head_commit":"3c56cf77d35e746f06702eef4d8ee1f98ccd29fb","level":"adapter_attested","method":"verification_summary","passed":true,"recorded_at":"2026-09-15T08:16:20.162Z","source":"queue"}},"generation":"g03","planning":{"commit":"c022f3c2bffe07b2f00cc3ba2dc174e82a8e2476","task_blob_digest":"sha256:06820d2ae853edf4f9226f63fdf61cd7dd76cf3441b4c890ab05e56937cff513"},"portable_digest":"sha256:8f760bc698f697031c94af8e8eaa34ec7b2dfb868025f4566b27d477d659218b","revision":8,"schema_version":"northstar.lifecycle.task-record.v1","stage":"none","status":"complete","task_id":"g03.017","task_path":"docs/roadmaps/g03/017-reject-transient-handoff-backlinks-before-merge.md","updated_at":"2026-09-15T08:16:20.162Z"}
