{"adapter":{"instance":"51d85fb4-5072-4dc9-bf65-bcae837de8a3","name":"queue-hook"},"applied_events":[{"content_digest":"sha256:ab867b67c62c82893b204ef6a0fac933a12215df983622094ee9c348be354a1a","event_id":"queue-8ecd120ad381a507c44f19304534e849-01-plan","revision":1,"transition":"plan"},{"content_digest":"sha256:4850ebf93fae8b75888eddacd34725d07c160de39abb4048f3eb849b1968359a","event_id":"queue-8ecd120ad381a507c44f19304534e849-02-ready","revision":2,"transition":"ready"},{"content_digest":"sha256:01fe955cda25e3935c1a304a59702e0be2d821e1b906d9553933ae8cef1cf4ac","event_id":"queue-8ecd120ad381a507c44f19304534e849-03-start","revision":3,"transition":"start"},{"content_digest":"sha256:1c201fa759edbadbceb813e9f294893f597100f4964ba8f5dd69057d7910430a","event_id":"queue-8ecd120ad381a507c44f19304534e849-04-advance_stage","revision":4,"transition":"advance_stage"},{"content_digest":"sha256:590c5a8e4dee70b0bb9a39188683ce5c24a24214e2065843f7b0df0f203b0dd5","event_id":"queue-8ecd120ad381a507c44f19304534e849-05-advance_stage","revision":5,"transition":"advance_stage"},{"content_digest":"sha256:12d316f6fe0c9a7599692427dd0d6fd0f92caff379a30effc1fd38013556a699","event_id":"queue-8ecd120ad381a507c44f19304534e849-06-advance_stage","revision":6,"transition":"advance_stage"},{"content_digest":"sha256:f36f0f6491f2ae711caa7e28e03b047ec1e1a9c87daf89f4a4f8d1da321f313e","event_id":"queue-8ecd120ad381a507c44f19304534e849-07-advance_stage","revision":7,"transition":"advance_stage"},{"content_digest":"sha256:c7197bac90ca74fcacd2884dd7cda772dbc80bd31ac3bc1cf7a164898881b6a4","event_id":"queue-8ecd120ad381a507c44f19304534e849-08-complete","revision":8,"transition":"complete"}],"delivery_policy":{"mode":"standard"},"dependencies":[],"digest":"sha256:da733286412d8cdf4c1e56ba0e48ea434e92539dd6da3f84b642da8ad809e3be","evidence":{"handoff":{"actor":"queue-hook","level":"locally_verified","method":"instruction_blob_digest","recorded_at":"2026-09-16T08:41:50.541Z","ref":"docs/handoffs/20260916-082154-g03-020-prospective-merge-portable-default.md","source":"docs"},"integration":{"actor":"queue-hook","level":"locally_verified","method":"synchronized_main","recorded_at":"2026-09-16T08:41:50.541Z","source":"git","synchronized_main_commit":"1161357fcabf40ee13163a989353cf981a195030"},"merge":{"actor":"queue-hook","base":"main","head_commit":"127a1a4ecd4c490f98d9b4f5c1636f5d4b3518bb","level":"locally_verified","merge_commit":"1161357fcabf40ee13163a989353cf981a195030","merge_method":"merge","method":"merge_ancestry","recorded_at":"2026-09-16T08:41:50.541Z","source":"git"},"pr":{"actor":"queue","head_commit":"127a1a4ecd4c490f98d9b4f5c1636f5d4b3518bb","level":"adapter_attested","method":"delivery_object","pr_number":59,"provider_ref":"https://github.com/inflatable-cookie/northstar/pull/59","recorded_at":"2026-09-16T08:41:50.541Z","source":"queue"},"review":{"actor":"queue","head_commit":"127a1a4ecd4c490f98d9b4f5c1636f5d4b3518bb","level":"adapter_attested","method":"delivery_object","recorded_at":"2026-09-16T08:41:50.541Z","review_id":"g03.020 review passed: v4/prospective-merge default across dogfood, template, and doctrine; bounded dry-run-first v3→v4 migration command with strict refusal matrix and byte isolation; shared manifest parser extraction preserves hook behavior; all QA (lifecycle-adoption, qa, qa:docs, lifecycle-core) green at expected head 127a1a4; installed-skill refresh correctly deferred to post-merge Chatterbox.","source":"queue","verdict":"approved"},"validation":{"actor":"queue","head_commit":"127a1a4ecd4c490f98d9b4f5c1636f5d4b3518bb","level":"adapter_attested","method":"verification_summary","passed":true,"recorded_at":"2026-09-16T08:41:50.541Z","source":"queue"}},"generation":"g03","planning":{"commit":"b34209e0aa14581353a6da26be8009d175f99af6","task_blob_digest":"sha256:595f36c4d14a85593acf0cf8b66006454093e83fec153d44346e218e0d32b043"},"portable_digest":"sha256:20e5f48d0e31a0d08c420590c552f444080e35291d1e9892d27c5690c25b12f7","revision":8,"schema_version":"northstar.lifecycle.task-record.v1","stage":"none","status":"complete","task_id":"g03.020","task_path":"docs/roadmaps/g03/020-prospective-merge-portable-default.md","updated_at":"2026-09-16T08:41:50.541Z"}
