{"adapter":{"instance":"73d569cd-82c1-427d-b636-d75117bbe350","name":"queue-hook"},"applied_events":[{"content_digest":"sha256:f2969baa8457b5279a6736df8182def5e2075fe5a6d11de42c882830ed00411a","event_id":"queue-4d333dcaf50e3066e6c84dfc61436ff4-01-plan","revision":1,"transition":"plan"},{"content_digest":"sha256:e0d599e2997913eeddf5069c1ce2ca86bae47eb689a540c135c6e8876433941e","event_id":"queue-4d333dcaf50e3066e6c84dfc61436ff4-02-ready","revision":2,"transition":"ready"},{"content_digest":"sha256:992369c13a91cd5730ab77d4d2af53893014905888a5bf205c29c3ce767399ec","event_id":"queue-4d333dcaf50e3066e6c84dfc61436ff4-03-start","revision":3,"transition":"start"},{"content_digest":"sha256:8246b5106d9b89639c49c65c515d36bb6a278d86c8bf72dd24d1f65518cb77c2","event_id":"queue-4d333dcaf50e3066e6c84dfc61436ff4-04-advance_stage","revision":4,"transition":"advance_stage"},{"content_digest":"sha256:321e96d7b468088ce823934446ca25e5269a32576d7ffb954d1c4e0b7b9e51c8","event_id":"queue-4d333dcaf50e3066e6c84dfc61436ff4-05-advance_stage","revision":5,"transition":"advance_stage"},{"content_digest":"sha256:f0d9d05a282d942ee6445755ab1e13e7417dae0cbc8ae2b8e1e1fa5d602da564","event_id":"queue-4d333dcaf50e3066e6c84dfc61436ff4-06-advance_stage","revision":6,"transition":"advance_stage"},{"content_digest":"sha256:47845016b009978a1e29499f670fd8c372f104a86f9e557cd2b4f45584efadc7","event_id":"queue-4d333dcaf50e3066e6c84dfc61436ff4-07-advance_stage","revision":7,"transition":"advance_stage"},{"content_digest":"sha256:00e76841cdd9bdc58875e03339f4aa3872684abbaf6d0ffaa1dd6d00f7be0247","event_id":"queue-4d333dcaf50e3066e6c84dfc61436ff4-08-complete","revision":8,"transition":"complete"}],"delivery_policy":{"mode":"standard"},"dependencies":[],"digest":"sha256:b006beb373606185905bfa5b56fd4a1f87dc3accb80141a82be312efdd5206dc","evidence":{"handoff":{"actor":"queue-hook","level":"locally_verified","method":"instruction_blob_digest","recorded_at":"2026-09-13T14:43:29.851Z","ref":"docs/handoffs/20260913-support-parallel-active-generation-projections.md","source":"docs"},"integration":{"actor":"queue-hook","level":"locally_verified","method":"synchronized_main","recorded_at":"2026-09-13T14:43:29.851Z","source":"git","synchronized_main_commit":"607830216918544fac98cbe4e5f103df7823bd87"},"merge":{"actor":"queue-hook","base":"main","head_commit":"aa02416e900863658d6fcec485618ae9aa7c5bfe","level":"locally_verified","merge_commit":"607830216918544fac98cbe4e5f103df7823bd87","merge_method":"merge","method":"merge_ancestry","recorded_at":"2026-09-13T14:43:29.851Z","source":"git"},"pr":{"actor":"queue","head_commit":"aa02416e900863658d6fcec485618ae9aa7c5bfe","level":"adapter_attested","method":"delivery_object","pr_number":50,"provider_ref":"https://github.com/inflatable-cookie/northstar/pull/50","recorded_at":"2026-09-13T14:43:29.851Z","source":"queue"},"review":{"actor":"queue","head_commit":"aa02416e900863658d6fcec485618ae9aa7c5bfe","level":"adapter_attested","method":"delivery_object","recorded_at":"2026-09-13T14:43:29.851Z","review_id":"g03.011 verified at exact head aa02416: canonical card authorized, PR50 MERGEABLE/CLEAN on base ff127ee, independent review 5653931579 maps all 7 oracle invariants with exact-head approval token, worker/reviewer/verifier provider identities distinct, tree clean, diff inside owned paths","source":"queue","verdict":"approved"},"validation":{"actor":"queue","head_commit":"aa02416e900863658d6fcec485618ae9aa7c5bfe","level":"adapter_attested","method":"verification_summary","passed":true,"recorded_at":"2026-09-13T14:43:29.851Z","source":"queue"}},"generation":"g03","planning":{"commit":"ff127eef605813fe82f694fe3075fd643225fd98","task_blob_digest":"sha256:86c63e9f6ad99e9375e3ddb577e7fe9f03c1af83dab52e2dc4999dc04eb2e016"},"portable_digest":"sha256:ab9b347fb9b134ebe8a664bbd99345ed81f32213b2d64cba6775210dc65eabbb","revision":8,"schema_version":"northstar.lifecycle.task-record.v1","stage":"none","status":"complete","task_id":"g03.011","task_path":"docs/roadmaps/g03/011-support-parallel-active-generation-projections.md","updated_at":"2026-09-13T14:43:29.851Z"}
