{"adapter":{"instance":"d32f39a0-29ea-4782-92ff-5381ccab400e","name":"queue-hook"},"applied_events":[{"content_digest":"sha256:749f66cb8c5375d91af6b77e7420fbb7b7275d263a4173b03c095f099f792be4","event_id":"queue-81b8491298f83cafff2e046cc84b8243-01-plan","revision":1,"transition":"plan"},{"content_digest":"sha256:c80deb0d0946b135fa48bce7c88494489c486447ab2b7aecd1fa2e4e7aaffeba","event_id":"queue-81b8491298f83cafff2e046cc84b8243-02-ready","revision":2,"transition":"ready"},{"content_digest":"sha256:73d07ac9b6b8a544680909e726235d03621b86e1ce71533537602d6c8f86eac0","event_id":"queue-81b8491298f83cafff2e046cc84b8243-03-start","revision":3,"transition":"start"},{"content_digest":"sha256:2b822b5b681355716e156b755f8eb1b80a5142d28ca5936b21944152ffd6bd04","event_id":"queue-81b8491298f83cafff2e046cc84b8243-04-advance_stage","revision":4,"transition":"advance_stage"},{"content_digest":"sha256:cd55fe2bf87a4a7ebf0b7e86ebd69cad5e09dd6b3d896a6727928f5707a42cbb","event_id":"queue-81b8491298f83cafff2e046cc84b8243-05-advance_stage","revision":5,"transition":"advance_stage"},{"content_digest":"sha256:83cf4c46e0e55b306e25053b1b8768a56207deea37abaadf01144bb092f5741a","event_id":"queue-81b8491298f83cafff2e046cc84b8243-06-advance_stage","revision":6,"transition":"advance_stage"},{"content_digest":"sha256:6f46b91b29f3700b4cd254f084094856bc2790244369418a547ae4499f59dc33","event_id":"queue-81b8491298f83cafff2e046cc84b8243-07-advance_stage","revision":7,"transition":"advance_stage"},{"content_digest":"sha256:a192d7b394373b102337f8ace2d821d67dc5fe93c506c7aac4b906cb0aa716a3","event_id":"queue-81b8491298f83cafff2e046cc84b8243-08-complete","revision":8,"transition":"complete"}],"delivery_policy":{"mode":"standard"},"dependencies":[],"digest":"sha256:a841a07bb97a64cf4d2bc3f5d3fb4f76c990d07c46d47fded5db68aa6c9c16be","evidence":{"handoff":{"actor":"queue-hook","level":"locally_verified","method":"instruction_blob_digest","recorded_at":"2026-09-14T19:59:58.708Z","ref":"docs/handoffs/20260914-173312-economical-chatterbox-frontier-oracle.md","source":"docs"},"integration":{"actor":"queue-hook","level":"locally_verified","method":"synchronized_main","recorded_at":"2026-09-14T19:59:58.708Z","source":"git","synchronized_main_commit":"a3cdf9660a11a417b06cb849a62d2159e0e8d695"},"merge":{"actor":"queue-hook","base":"main","head_commit":"c20770b68489b41b12a1b53e585ccb3b45a72060","level":"locally_verified","merge_commit":"a3cdf9660a11a417b06cb849a62d2159e0e8d695","merge_method":"merge","method":"merge_ancestry","recorded_at":"2026-09-14T19:59:58.708Z","source":"git"},"pr":{"actor":"queue","head_commit":"c20770b68489b41b12a1b53e585ccb3b45a72060","level":"adapter_attested","method":"delivery_object","pr_number":55,"provider_ref":"https://github.com/inflatable-cookie/northstar/pull/55","recorded_at":"2026-09-14T19:59:58.708Z","source":"queue"},"review":{"actor":"queue","head_commit":"c20770b68489b41b12a1b53e585ccb3b45a72060","level":"adapter_attested","method":"delivery_object","recorded_at":"2026-09-14T19:59:58.708Z","review_id":"Independent exact-head review of g03.016 at c20770b: full QA, docs QA, model-routing (13 oracle rows incl. decision-risk gate fixtures), command-skills, installed-skill parity (129 files), agent-instructions, posture-advisory, bundle, chatterbox-git, and git diff --check all pass; Oracle/planning-delegate and Coordinator renames verified atomic with no alias; authority separation, mandatory risk gate, manifest disposition, dossier redaction, provider neutrality, Coordinator portability, and thread/workspace preservation all confirmed; no new broken links. Non-blocking cosmetics noted (historical superseded sections retain old prose; three 'orchestrator' lines in pr-review.md; 'An `coordinator-continuation`' grammar slip in template-bundle/handoffs/README.md).","source":"queue","verdict":"approved"},"validation":{"actor":"queue","head_commit":"c20770b68489b41b12a1b53e585ccb3b45a72060","level":"adapter_attested","method":"verification_summary","passed":true,"recorded_at":"2026-09-14T19:59:58.708Z","source":"queue"}},"generation":"g03","planning":{"commit":"7ef1a0f5ebc9d37bf7c592e37286c839a9d31301","task_blob_digest":"sha256:e1dc0874d55f1aaba128973c9f5aa094e633976eceb37764fcaff40c0882f70c"},"portable_digest":"sha256:7a716ac752646a95b174be143fcce3426531f5d6203f3ae130f8cd85c7743685","revision":8,"schema_version":"northstar.lifecycle.task-record.v1","stage":"none","status":"complete","task_id":"g03.016","task_path":"docs/roadmaps/g03/016-economical-chatterbox-frontier-oracle.md","updated_at":"2026-09-14T19:59:58.708Z"}
