{"adapter":{"instance":"0ec5132c-3268-4330-90af-1b7d833df3aa","name":"queue-hook"},"applied_events":[{"content_digest":"sha256:361433347e987b5c5241e5ccab268228881c3565ae8cd17e7aac2fa76d95075f","event_id":"queue-dbb6ba9085244f3ba10b78b2afbc6560-01-plan","revision":1,"transition":"plan"},{"content_digest":"sha256:ca43a26d475cf37a5bac17c8159a1bcfb795e8e6a037498748fdf7b0c3cf5102","event_id":"queue-dbb6ba9085244f3ba10b78b2afbc6560-02-ready","revision":2,"transition":"ready"},{"content_digest":"sha256:bd643a908f5b077a0ec04629f99c8d03b7ccaf25c513cc99b8570648ffac0614","event_id":"queue-dbb6ba9085244f3ba10b78b2afbc6560-03-start","revision":3,"transition":"start"},{"content_digest":"sha256:dbf505e96034504b3d2dbc062ffe4f6f4e196c07cf62e356af67d830ef364d39","event_id":"queue-dbb6ba9085244f3ba10b78b2afbc6560-04-advance_stage","revision":4,"transition":"advance_stage"},{"content_digest":"sha256:dcfca02ca9ba5206fd0bc02d8247c9970e418160815b14ba36d61d0db6baabb7","event_id":"queue-dbb6ba9085244f3ba10b78b2afbc6560-05-advance_stage","revision":5,"transition":"advance_stage"},{"content_digest":"sha256:7bffa977069b4260272530ec252f6b514d3fefe76f393f670a73abaa03cb4952","event_id":"queue-dbb6ba9085244f3ba10b78b2afbc6560-06-advance_stage","revision":6,"transition":"advance_stage"},{"content_digest":"sha256:3fb7ebfd00aead28fdff4a9cbb99810881fcdc3e523dc4e74da24e595828f3aa","event_id":"queue-dbb6ba9085244f3ba10b78b2afbc6560-07-advance_stage","revision":7,"transition":"advance_stage"},{"content_digest":"sha256:edee2e8c05e300f6da778a7f90b66b5243e3b6687e1f1b186a4d453a49c16663","event_id":"queue-dbb6ba9085244f3ba10b78b2afbc6560-08-complete","revision":8,"transition":"complete"}],"delivery_policy":{"mode":"standard"},"dependencies":[],"digest":"sha256:76d6a4c9b2956db2e27f351809da4cc0222eeac31ef4d4789468b76ce198bc30","evidence":{"handoff":{"actor":"queue-hook","level":"locally_verified","method":"instruction_blob_digest","recorded_at":"2026-09-15T19:06:50.055Z","ref":"docs/handoffs/20260915-192956-accept-prospective-merge-queue-events.md","source":"docs"},"integration":{"actor":"queue-hook","level":"locally_verified","method":"synchronized_main","recorded_at":"2026-09-15T19:06:50.055Z","source":"git","synchronized_main_commit":"99241b925ade87d4f3cfe3cd57e39328b4ad79ff"},"merge":{"actor":"queue-hook","base":"main","head_commit":"11ab5b6186e7e10d46b39659df1062697768994b","level":"locally_verified","merge_commit":"99241b925ade87d4f3cfe3cd57e39328b4ad79ff","merge_method":"merge","method":"merge_ancestry","recorded_at":"2026-09-15T19:06:50.055Z","source":"git"},"pr":{"actor":"queue","head_commit":"11ab5b6186e7e10d46b39659df1062697768994b","level":"adapter_attested","method":"delivery_object","pr_number":58,"provider_ref":"https://github.com/inflatable-cookie/northstar/pull/58","recorded_at":"2026-09-15T19:06:50.055Z","source":"queue"},"review":{"actor":"queue","head_commit":"11ab5b6186e7e10d46b39659df1062697768994b","level":"adapter_attested","method":"delivery_object","recorded_at":"2026-09-15T19:06:50.055Z","review_id":"g03.019 review: ready_to_merge at exact head 11ab5b6. Event-v3/control-v4 mirrors match Queue 4443185 and spec 015; prospective binding rules and candidate identity proofs fail closed in the required order; reviewed-head and v1-v3 behavior preserved; old mirrors untouched. effigy qa, qa:docs, lifecycle-adoption (incl. isolated install parity), and git diff --check all pass on a clean tree. Full findings in reviewText.","source":"queue","verdict":"approved"},"validation":{"actor":"queue","head_commit":"11ab5b6186e7e10d46b39659df1062697768994b","level":"adapter_attested","method":"verification_summary","passed":true,"recorded_at":"2026-09-15T19:06:50.055Z","source":"queue"}},"generation":"g03","planning":{"commit":"64bf87a6275a67bc354ed22acd53be63e042398f","task_blob_digest":"sha256:d80c0023aec063d5b3607b1e3e8542e6f26690cae70955b3403a1e40921a3ef2"},"portable_digest":"sha256:46b78968687256ce5a1a14b7768c8daa4e0b388b5574dd36833278e9e971e2c6","revision":8,"schema_version":"northstar.lifecycle.task-record.v1","stage":"none","status":"complete","task_id":"g03.019","task_path":"docs/roadmaps/g03/019-accept-prospective-merge-queue-events.md","updated_at":"2026-09-15T19:06:50.055Z"}
