{"adapter":{"instance":"8c8f8655-ece1-47d1-aded-d4d676a84ed6","name":"queue-hook"},"applied_events":[{"content_digest":"sha256:9d887daa899e16c5b2588b0e4029ad243221b52ecf8698f360e2981d780a8209","event_id":"queue-95f6c82fe84e4634508841cb6aafc235-01-plan","revision":1,"transition":"plan"},{"content_digest":"sha256:c160abff3414c2b7ce24ce39702fc5f77a2b7fbac1700c761e2ee50cd46dacd7","event_id":"queue-95f6c82fe84e4634508841cb6aafc235-02-ready","revision":2,"transition":"ready"},{"content_digest":"sha256:07b0f377d69ef96a059e108e9807f689623df2e94dcf5b244b2522fa5919d976","event_id":"queue-95f6c82fe84e4634508841cb6aafc235-03-start","revision":3,"transition":"start"},{"content_digest":"sha256:5d04cd335b441eafb42d710e02e8ebcac5e3adf3c14f41d30c2b5a7fedb11a65","event_id":"queue-95f6c82fe84e4634508841cb6aafc235-04-advance_stage","revision":4,"transition":"advance_stage"},{"content_digest":"sha256:8d3c18df7c4edc19397b6ba5e022f256950040e18e8955f3c6207d9b447dc3f5","event_id":"queue-95f6c82fe84e4634508841cb6aafc235-05-advance_stage","revision":5,"transition":"advance_stage"},{"content_digest":"sha256:7cac874799071315aa85cf83ac49f8d987401145abd1b264a69db282f40471d5","event_id":"queue-95f6c82fe84e4634508841cb6aafc235-06-advance_stage","revision":6,"transition":"advance_stage"},{"content_digest":"sha256:164e50afdcd8867295c7e210927eacb7a1a7374916cf586b489a6577dc8ae000","event_id":"queue-95f6c82fe84e4634508841cb6aafc235-07-advance_stage","revision":7,"transition":"advance_stage"},{"content_digest":"sha256:dc0f374f8950bb55fdd38ce95ee39c6916a76f36ed0c781a9143189d4ac22d1b","event_id":"queue-95f6c82fe84e4634508841cb6aafc235-08-complete","revision":8,"transition":"complete"}],"delivery_policy":{"mode":"standard"},"dependencies":[],"digest":"sha256:c8a09f2d3daad05e3b90235bc50f256c3932eeddaee668adecd9dad1183ac8e2","evidence":{"handoff":{"actor":"queue-hook","level":"locally_verified","method":"instruction_blob_digest","recorded_at":"2026-09-13T09:35:22.562Z","ref":"docs/handoffs/20260913-092454-separate-planning-required-from-generation-closure.md","source":"docs"},"integration":{"actor":"queue-hook","level":"locally_verified","method":"synchronized_main","recorded_at":"2026-09-13T09:35:22.562Z","source":"git","synchronized_main_commit":"42e6583dd413c513098d37b75f8ea8e523f9aa17"},"merge":{"actor":"queue-hook","base":"main","head_commit":"60e831519e7e8854dda443f53544754e2b3e1cf0","level":"locally_verified","merge_commit":"42e6583dd413c513098d37b75f8ea8e523f9aa17","merge_method":"merge","method":"merge_ancestry","recorded_at":"2026-09-13T09:35:22.562Z","source":"git"},"pr":{"actor":"queue","head_commit":"60e831519e7e8854dda443f53544754e2b3e1cf0","level":"adapter_attested","method":"delivery_object","pr_number":48,"provider_ref":"https://github.com/inflatable-cookie/northstar/pull/48","recorded_at":"2026-09-13T09:35:22.562Z","source":"queue"},"review":{"actor":"queue","head_commit":"60e831519e7e8854dda443f53544754e2b3e1cf0","level":"adapter_attested","method":"delivery_object","recorded_at":"2026-09-13T09:35:22.562Z","review_id":"g03.009 coordinator verification: canonical roadmap authorization holds; PR 48 head 60e831519e7e8854dda443f53544754e2b3e1cf0 is clean single-commit on base 09d95a1 (=main/merge-base); independent review comment 5652451414 names exact head with ready_to_merge token (reviewer run c63915ed, role reviewer, Deepseek profile distinct from GLM 5.3 worker); review verifies all oracle axes with no required findings and no reserved-surface touch.","source":"queue","verdict":"approved"},"validation":{"actor":"queue","head_commit":"60e831519e7e8854dda443f53544754e2b3e1cf0","level":"adapter_attested","method":"verification_summary","passed":true,"recorded_at":"2026-09-13T09:35:22.562Z","source":"queue"}},"generation":"g03","planning":{"commit":"09d95a1c39ae69df2b2995c07409832a2cec821d","task_blob_digest":"sha256:50f463380b09a1c5f6d296b01b910921915833af98566a1f55c48a12dd2e794b"},"portable_digest":"sha256:f2a35c6038f6b238310db7230632037d336b4747e5199ba619fb26cf8352ea0b","revision":8,"schema_version":"northstar.lifecycle.task-record.v1","stage":"none","status":"complete","task_id":"g03.009","task_path":"docs/roadmaps/g03/009-separate-planning-required-from-generation-closure.md","updated_at":"2026-09-13T09:35:22.562Z"}
