{"adapter":{"instance":"03795999-199b-4787-ae49-ffbbd3c54c72","name":"queue-hook"},"applied_events":[{"content_digest":"sha256:17004b371b73922f23910f9fc46d1aeaa4d9d3b8e3e69d107117a4ade86fffd0","event_id":"queue-abf8d7539fc17611c7a3bed43248a7aa-01-plan","revision":1,"transition":"plan"},{"content_digest":"sha256:ad38265bed81aa5dcdb51eefd7b7880e71890fb05479e865fc0bb36c2d865ed6","event_id":"queue-abf8d7539fc17611c7a3bed43248a7aa-02-ready","revision":2,"transition":"ready"},{"content_digest":"sha256:e83bd316c7152d3d70e27ec5aa5e68af309a91ba44f20473efd635f68f09fe19","event_id":"queue-abf8d7539fc17611c7a3bed43248a7aa-03-start","revision":3,"transition":"start"},{"content_digest":"sha256:422d6d441d956c03d50076599cb20651326b20e5eaf19fe8ad84c0659686dfe2","event_id":"queue-abf8d7539fc17611c7a3bed43248a7aa-04-advance_stage","revision":4,"transition":"advance_stage"},{"content_digest":"sha256:5bb18677adbc730800b8cbf3ade6630b0de49ff998ba8227dc3658ec745ef48e","event_id":"queue-abf8d7539fc17611c7a3bed43248a7aa-05-advance_stage","revision":5,"transition":"advance_stage"},{"content_digest":"sha256:8d8bb0f13e0fc4d1ac6c8e84d12c90c2bf0cfac48d0000d7a11304addfe7f3ea","event_id":"queue-abf8d7539fc17611c7a3bed43248a7aa-06-advance_stage","revision":6,"transition":"advance_stage"},{"content_digest":"sha256:34d952fcb5ca5efac1345246dc52bc9980707d3b1a6448344c479a923755354c","event_id":"queue-abf8d7539fc17611c7a3bed43248a7aa-07-advance_stage","revision":7,"transition":"advance_stage"},{"content_digest":"sha256:df023ffef574b0c8c94c6ec3832c641bd77f2d5e5ace115b94314b4f18f91ab5","event_id":"queue-abf8d7539fc17611c7a3bed43248a7aa-08-complete","revision":8,"transition":"complete"}],"delivery_policy":{"mode":"standard"},"dependencies":[],"digest":"sha256:c1035ad4e0adc5dec9a9723c622acadf1e2ab689883f1711e4f2c435ac519df8","evidence":{"handoff":{"actor":"queue-hook","level":"locally_verified","method":"instruction_blob_digest","recorded_at":"2026-09-14T00:04:58.030Z","ref":"docs/handoffs/20260914-004200-bound-aggregate-backlink-scan.md","source":"docs"},"integration":{"actor":"queue-hook","level":"locally_verified","method":"synchronized_main","recorded_at":"2026-09-14T00:04:58.030Z","source":"git","synchronized_main_commit":"50d4495572eaf6a0c2f670038193a6be67d02c1e"},"merge":{"actor":"queue-hook","base":"main","head_commit":"61ef95cffa0f71c5ccdffe5cb1c35c90ba84764c","level":"locally_verified","merge_commit":"50d4495572eaf6a0c2f670038193a6be67d02c1e","merge_method":"merge","method":"merge_ancestry","recorded_at":"2026-09-14T00:04:58.030Z","source":"git"},"pr":{"actor":"queue","head_commit":"61ef95cffa0f71c5ccdffe5cb1c35c90ba84764c","level":"adapter_attested","method":"delivery_object","pr_number":54,"provider_ref":"https://github.com/inflatable-cookie/northstar/pull/54","recorded_at":"2026-09-14T00:04:58.030Z","source":"queue"},"review":{"actor":"queue","head_commit":"61ef95cffa0f71c5ccdffe5cb1c35c90ba84764c","level":"adapter_attested","method":"delivery_object","recorded_at":"2026-09-14T00:04:58.030Z","review_id":"Independent review of PR #54 at head 61ef95c passed. Verified all four finite bounds (25,000 tracked Markdown files, 64 MiB aggregate via lstat preflight before any content read, retained 4 MiB per-file and 4 MiB listing transport), overflow-safe aggregate accumulation, and atomic refusal ordering (guard runs before consumeHandoff/applyMapped). No path special cases; exact-link controls untouched. New self-test fixtures for Bovine-shaped 18,190-file success, 25,001-file count overflow, and 65 MiB aggregate overflow all pass with atomicity assertions. effigy qa full board exit 0, check:lifecycle-adoption OK, git diff --check clean, advisory agent-instruction check clean. Installed-skill parity drift is exactly the PR's two files vs the parent commit, expected pre-merge per handoff protocol. Review posted with ready_to_merge verdict.","source":"queue","verdict":"approved"},"validation":{"actor":"queue","head_commit":"61ef95cffa0f71c5ccdffe5cb1c35c90ba84764c","level":"adapter_attested","method":"verification_summary","passed":true,"recorded_at":"2026-09-14T00:04:58.030Z","source":"queue"}},"generation":"g03","planning":{"commit":"1c8644362add0373727562f858cfeeca5655e781","task_blob_digest":"sha256:2170553df270380d404462da49b2c78a39cdda4c3606273fc6289fbd0c0230dd"},"portable_digest":"sha256:fa2e1a473873fb2503921d05aa279191c798a6cb1c4878921a7113e2fe0b877c","revision":8,"schema_version":"northstar.lifecycle.task-record.v1","stage":"none","status":"complete","task_id":"g03.015","task_path":"docs/roadmaps/g03/015-bound-aggregate-backlink-scan.md","updated_at":"2026-09-14T00:04:58.030Z"}
